{
 "schema_version": "1.0.0",
 "compile_hash": "office-south-strip-v1",
 "modules": [
  {
   "name": "S",
   "library_index": 0
  },
  {
   "name": "WL",
   "library_index": 1
  },
  {
   "name": "WR",
   "library_index": 2
  },
  {
   "name": "E",
   "library_index": 3
  },
  {
   "name": "DL",
   "library_index": 4
  },
  {
   "name": "DR",
   "library_index": 5
  },
  {
   "name": "ST",
   "library_index": 6
  }
 ],
 "variants": [
  {
   "module": 0,
   "rotation": 0,
   "part": 0,
   "anchor": true
  },
  {
   "module": 1,
   "rotation": 0,
   "part": 0,
   "anchor": true
  },
  {
   "module": 2,
   "rotation": 0,
   "part": 0,
   "anchor": true
  },
  {
   "module": 3,
   "rotation": 0,
   "part": 0,
   "anchor": true
  },
  {
   "module": 4,
   "rotation": 0,
   "part": 0,
   "anchor": true
  },
  {
   "module": 5,
   "rotation": 0,
   "part": 0,
   "anchor": true
  },
  {
   "module": 6,
   "rotation": 0,
   "part": 0,
   "anchor": true
  }
 ],
 "ports": 6,
 "allowed": [
  {
   "port": 0,
   "twist": 0,
   "pairs": [
    [
     0,
     0
    ],
    [
     0,
     1
    ],
    [
     1,
     2
    ],
    [
     2,
     0
    ],
    [
     3,
     3
    ],
    [
     3,
     4
    ],
    [
     3,
     6
    ],
    [
     6,
     3
    ],
    [
     6,
     4
    ],
    [
     6,
     6
    ],
    [
     4,
     5
    ],
    [
     5,
     3
    ],
    [
     5,
     4
    ],
    [
     5,
     6
    ]
   ]
  },
  {
   "port": 1,
   "twist": 0,
   "pairs": [
    [
     0,
     0
    ],
    [
     1,
     0
    ],
    [
     2,
     1
    ],
    [
     0,
     2
    ],
    [
     3,
     3
    ],
    [
     4,
     3
    ],
    [
     6,
     3
    ],
    [
     3,
     6
    ],
    [
     4,
     6
    ],
    [
     6,
     6
    ],
    [
     5,
     4
    ],
    [
     3,
     5
    ],
    [
     4,
     5
    ],
    [
     6,
     5
    ]
   ]
  },
  {
   "port": 2,
   "twist": 0,
   "pairs": [
    [
     0,
     3
    ],
    [
     0,
     6
    ],
    [
     1,
     3
    ],
    [
     1,
     4
    ],
    [
     2,
     3
    ],
    [
     2,
     5
    ]
   ]
  },
  {
   "port": 3,
   "twist": 0,
   "pairs": [
    [
     3,
     0
    ],
    [
     6,
     0
    ],
    [
     3,
     1
    ],
    [
     4,
     1
    ],
    [
     3,
     2
    ],
    [
     5,
     2
    ]
   ]
  }
 ],
 "slots": 14,
 "edges": {
  "offsets": [
   0,
   2,
   5,
   8,
   11,
   14,
   17,
   19,
   21,
   24,
   27,
   30,
   33,
   36,
   38
  ],
  "port": [
   0,
   2,
   0,
   1,
   2,
   0,
   1,
   2,
   0,
   1,
   2,
   0,
   1,
   2,
   0,
   1,
   2,
   1,
   2,
   0,
   3,
   0,
   1,
   3,
   0,
   1,
   3,
   0,
   1,
   3,
   0,
   1,
   3,
   0,
   1,
   3,
   1,
   3
  ],
  "neighbour": [
   1,
   7,
   2,
   0,
   8,
   3,
   1,
   9,
   4,
   2,
   10,
   5,
   3,
   11,
   6,
   4,
   12,
   5,
   13,
   8,
   0,
   9,
   7,
   1,
   10,
   8,
   2,
   11,
   9,
   3,
   12,
   10,
   4,
   13,
   11,
   5,
   12,
   6
  ],
  "neighbour_port": [
   1,
   3,
   1,
   0,
   3,
   1,
   0,
   3,
   1,
   0,
   3,
   1,
   0,
   3,
   1,
   0,
   3,
   0,
   3,
   1,
   2,
   1,
   0,
   2,
   1,
   0,
   2,
   1,
   0,
   2,
   1,
   0,
   2,
   1,
   0,
   2,
   0,
   2
  ],
  "twist": [
   0,
   0,
   0,
   0,
   0,
   0,
   0,
   0,
   0,
   0,
   0,
   0,
   0,
   0,
   0,
   0,
   0,
   0,
   0,
   0,
   0,
   0,
   0,
   0,
   0,
   0,
   0,
   0,
   0,
   0,
   0,
   0,
   0,
   0,
   0,
   0,
   0,
   0
  ]
 },
 "domain_classes": [
  [
   0,
   1,
   2
  ],
  [
   3,
   4,
   5,
   6
  ],
  [
   0
  ],
  [
   0,
   2
  ],
  [
   3,
   4,
   6
  ],
  [
   3,
   5,
   6
  ]
 ],
 "slot_domain": [
  2,
  0,
  0,
  0,
  0,
  0,
  3,
  4,
  1,
  1,
  1,
  1,
  1,
  5
 ],
 "variant_weight": [
  1.0,
  2.0,
  2.0,
  2.0,
  8.0,
  8.0,
  1.0
 ],
 "settings": {
  "seed": 1,
  "attempts": 8,
  "threads": 2,
  "backtrack_budget": 100,
  "max_observations": 0,
  "mode": "collapse"
 }
}